<?xml version="1.0" encoding="UTF-8"?>
<impresoras xmlns:xsi="http://www.w3.org/2001/XMLSchema-instance" xsi:noNamespaceSchemaLocation="403repaso.xsd">
    <impresora numSerie="i245" tecnologia="láser" compra="2010">
        <fabricante>Epson</fabricante>
        <modelo>EPL300</modelo>
        <peso>4.52</peso>
        <tamaño>A4</tamaño>
        <tamaño>A5</tamaño>
        <cartucho>C-123BV</cartucho>
        <enred />
    </impresora>
    <impresora numSerie="i246" tecnologia="matricial">
        <fabricante>HP</fabricante>
        <modelo>LaserJet 2410</modelo>
        <peso>3.2</peso>
        <tamaño>A4</tamaño>
        <cartucho>C-456P</cartucho>
    </impresora>
</impresoras>
